Parameter,Description,Estimate,Lower,Upper,Units,Source
alpha_AA,annual-annual competition,0.001,1.7883331362832339e-4,0.0021630854431439,g^-1^,experiment
alpha_AA_fung,annual-annual competition (disease-free),0.001,NA,NA,g^-1^,experiment
alpha_AF,annual-first-year perennial competition,0,NA,NA,g^-1^,experiment
alpha_AF_fung,annual-first-year perennial competition (disease-free),0,NA,NA,g^-1^,experiment
alpha_AP,annual-adult perennial competition,0.0065,NA,NA,g^-1^,experiment
alpha_AP_fung,annual-adult perennial competition (disease-free),0.0065,0.003767926288460944,0.009381946235081652,g^-1^,experiment
alpha_FA,first-year perennial-annual competition,0.001,9.491685436740821e-5,0.00218503945208079,g^-1^,experiment
alpha_FA_fung,first-year perennial-annual competition (disease-free),0.001,2.701769412984964e-4,0.0017056184850390101,g^-1^,experiment
alpha_FF,first-year perennial-first-year perennial competition,0,NA,NA,g^-1^,experiment
alpha_FF_fung,first-year perennial-first-year perennial competition (disease-free),0,NA,NA,g^-1^,experiment
alpha_FP,first-year perennial-adult perennial competition,0.0065,NA,NA,g^-1^,experiment
alpha_FP_fung,first-year perennial-adult perennial competition (disease-free),0.0065,0.0028121502854291163,0.009236108215515638,g^-1^,experiment
alpha_PA,adult perennial-annual competition,0.001,NA,NA,g^-1^,experiment
alpha_PA_fung,adult perennial-annual competition (disease-free),0.001,NA,NA,g^-1^,experiment
alpha_PF,adult perennial-first-year perennial competition,0,NA,NA,g^-1^,experiment
alpha_PF_fung,adult perennial-first-year perennial competition (disease-free),0,NA,NA,g^-1^,experiment
alpha_PP,adult perennial-adult perennial competition,0.0065,NA,NA,g^-1^,experiment
alpha_PP_fung,adult perennial-adult perennial competition (disease-free),0.0065,NA,NA,g^-1^,experiment
r_A,annual growth rate,0.038430789299326834,0.03551454119692858,0.04194070946286447,day^-1^,experiment
r_F,perennial first-year growth rate,0.037438051598000475,0.034184166946605345,0.040722871263787506,day^-1^,experiment
r_P,perennial adult growth rate,0.03232887800647988,0.02863575176871911,0.036313405816543146,day^-1^,experiment
beta_AA,annual-annual transmission,0.03821817221375853,0.011980078852740902,0.06704606456224907,day^-1^ g^-1^,experiment
beta_AF,annual-first-year perennial transmission,0,NA,NA,day^-1^ g^-1^,experiment
beta_AP,annual-adult perennial transmission,0,NA,NA,day^-1^ g^-1^,experiment
beta_FA,first-year perennial-annual transmission,0.06813475856152575,3.741243108267881e-4,0.13527588708840377,day^-1^ g^-1^,experiment
beta_FF,first-year perennial-first-year perennial transmission,0,NA,NA,day^-1^ g^-1^,experiment
beta_FP,first-year perennial-adult perennial transmission,0.03431439567737486,0.00509978555267915,0.06331095491436185,day^-1^ g^-1^,experiment
beta_PA,adult perennial-annual transmission,0.0709431825219581,0.034294279737049474,0.10785633858426362,day^-1^ g^-1^,experiment
beta_PF,adult perennial-first-year perennial transmission,0,NA,NA,day^-1^ g^-1^,experiment
beta_PP,adult perennial-adult perennial transmission,0,NA,NA,day^-1^ g^-1^,experiment
p0,seed infection parameter,-2.914,-3.199,-2.647,"NA",experiment
p1,seed infection parameter,2.524,1.184,3.863,"NA",experiment
g_I,infected annual germination fraction,0.316,0.182,0.458,"NA",experiment
g_S,susceptible annual germination fraction,0.767,0.733,0.8,"NA",experiment
g_P,perennial germination fraction,0.24048411514474585,0.034657968424431966,0.4395512950320474,"NA",experiment
c_A,annual seed conversion,76.91213399302326,69.19096928570664,84.42525364871562,seeds g^-1^,experiment
c_F,first-year perennial seed conversion,8.476030789055871,6.997022970125732,9.999516239481084,seeds g^-1^,experiment
c_P,adult perennial seed conversion,19.084498055179633,16.209390679370646,21.98089920102739,seeds g^-1^,experiment
e_A,annual establishment fraction,0.9490323342553639,0.9144625556014616,0.9806709158889197,"NA",experiment
e_P,perennial establishment fraction,0.5531020953855147,0.4065253408230047,0.6958544000552291,"NA",experiment
l_P,adult perennial survival fraction,0.8764804924301219,0.6196207826181906,0.9826180206947736,"NA",experiment
n_P,adult perennial surviving biomass,0.38042768251224895,NA,NA,"NA",experiment
b_A,annual initial biomass,0.031,NA,NA,g,experiment
b_F,first-year perennial initial biomass,0.004,NA,NA,g,experiment
b_P,adult perennial initial biomass,0.031,NA,NA,g,experiment
m_A,annual biomass mortality,0.0019382188280760476,NA,NA,"NA",experiment
m_F,perennial first-year biomass mortality,0.0019382188280760476,NA,NA,"NA",experiment
m_P,perennial adult biomass mortality,0.0019382188280760476,NA,NA,"NA",experiment
gamma_A,annual sensitivity to litter,0.001184393821520858,4.191629405253904e-4,0.0020098330356090677,g^-1^,Benitez et al. 2021
gamma_P,perennial sensitivity to litter,5.029738597082376e-4,9.334561098983917e-6,9.899256961051154e-4,g^-1^,Benitez et al. 2021
beta_AC,litter transmission to annuals,0.001,NA,NA,day^-1^ g^-1^,"NA"
beta_FC,litter transmission to first-year perennials,0.001,NA,NA,day^-1^ g^-1^,"NA"
beta_PC,litter transmission to adult perennials,0.001,NA,NA,day^-1^ g^-1^,"NA"
k_A,transmission saturation constant for annuals,10,NA,NA,g,"NA"
k_F,transmission saturation constant for first-year perennials,10,NA,NA,g,"NA"
k_P,transmission saturation constant for adult perennials,10,NA,NA,g,"NA"
v_A,annual infected tissue loss,0.001,NA,NA,day^-1^,"NA"
v_F,perennial first-year infected tissue loss,0.001,NA,NA,day^-1^,"NA"
v_P,perennial adult infected tissue loss,0.001,NA,NA,day^-1^,"NA"
h,inoculum addition to litter,5500,NA,NA,g^-1^,Benitez et al. 2020
b,inoculum loss from litter,0.5,NA,NA,day^-1^,"NA"
s_A,annual surviving seed fraction,0.15,NA,NA,"NA",Redwood et al. 2018
s_P,perennial surviving seed fraction,0.05,NA,NA,"NA",Garrison and Stier 2010
d,annual litter decomposition fraction,0.59,NA,NA,"NA",DeMeester and Richter 2010
